{"test_class": {"identifier": "XYAreaRendererTests", "superclass": "extends TestCase", "interfaces": "", "fields": [], "file": "tests/org/jfree/chart/renderer/xy/junit/XYAreaRendererTests.java"}, "test_case": {"identifier": "testGetLegendItemSeriesIndex", "parameters": "()", "modifiers": "public", "return": "void", "body": "public void testGetLegendItemSeriesIndex() {\n        XYSeriesCollection d1 = new XYSeriesCollection();\n        XYSeries s1 = new XYSeries(\"S1\");\n        s1.add(1.0, 1.1);\n        XYSeries s2 = new XYSeries(\"S2\");\n        s2.add(1.0, 1.1);\n        d1.addSeries(s1);\n        d1.addSeries(s2);\n\n        XYSeriesCollection d2 = new XYSeriesCollection();\n        XYSeries s3 = new XYSeries(\"S3\");\n        s3.add(1.0, 1.1);\n        XYSeries s4 = new XYSeries(\"S4\");\n        s4.add(1.0, 1.1);\n        XYSeries s5 = new XYSeries(\"S5\");\n        s5.add(1.0, 1.1);\n        d2.addSeries(s3);\n        d2.addSeries(s4);\n        d2.addSeries(s5);\n\n        XYAreaRenderer r = new XYAreaRenderer();\n        XYPlot plot = new XYPlot(d1, new NumberAxis(\"x\"),\n                new NumberAxis(\"y\"), r);\n        plot.setDataset(1, d2);\n        /*JFreeChart chart =*/ new JFreeChart(plot);\n        LegendItem li = r.getLegendItem(1, 2);\n        assertEquals(\"S5\", li.getLabel());\n        assertEquals(1, li.getDatasetIndex());\n        assertEquals(2, li.getSeriesIndex());\n    }", "signature": "void testGetLegendItemSeriesIndex()", "full_signature": "public void testGetLegendItemSeriesIndex()", "class_method_signature": "XYAreaRendererTests.testGetLegendItemSeriesIndex()", "testcase": true, "constructor": false, "invocations": ["add", "add", "addSeries", "addSeries", "add", "add", "add", "addSeries", "addSeries", "addSeries", "setDataset", "getLegendItem", "assertEquals", "getLabel", "assertEquals", "getDatasetIndex", "assertEquals", "getSeriesIndex"]}, "focal_class": {"identifier": "XYAreaRenderer", "superclass": "extends AbstractXYItemRenderer", "interfaces": "implements XYItemRenderer, PublicCloneable", "fields": [{"original_string": "private static final long serialVersionUID = -4481971353973876747L;", "modifier": "private static final", "type": "long", "declarator": "serialVersionUID = -4481971353973876747L", "var_name": "serialVersionUID"}, {"original_string": "public static final int SHAPES = 1;", "modifier": "public static final", "type": "int", "declarator": "SHAPES = 1", "var_name": "SHAPES"}, {"original_string": "public static final int LINES = 2;", "modifier": "public static final", "type": "int", "declarator": "LINES = 2", "var_name": "LINES"}, {"original_string": "public static final int SHAPES_AND_LINES = 3;", "modifier": "public static final", "type": "int", "declarator": "SHAPES_AND_LINES = 3", "var_name": "SHAPES_AND_LINES"}, {"original_string": "public static final int AREA = 4;", "modifier": "public static final", "type": "int", "declarator": "AREA = 4", "var_name": "AREA"}, {"original_string": "public static final int AREA_AND_SHAPES = 5;", "modifier": "public static final", "type": "int", "declarator": "AREA_AND_SHAPES = 5", "var_name": "AREA_AND_SHAPES"}, {"original_string": "private boolean plotShapes;", "modifier": "private", "type": "boolean", "declarator": "plotShapes", "var_name": "plotShapes"}, {"original_string": "private boolean plotLines;", "modifier": "private", "type": "boolean", "declarator": "plotLines", "var_name": "plotLines"}, {"original_string": "private boolean plotArea;", "modifier": "private", "type": "boolean", "declarator": "plotArea", "var_name": "plotArea"}, {"original_string": "private boolean showOutline;", "modifier": "private", "type": "boolean", "declarator": "showOutline", "var_name": "showOutline"}, {"original_string": "private transient Shape legendArea;", "modifier": "private transient", "type": "Shape", "declarator": "legendArea", "var_name": "legendArea"}, {"original_string": "private boolean useFillPaint;", "modifier": "private", "type": "boolean", "declarator": "useFillPaint", "var_name": "useFillPaint"}, {"original_string": "private GradientPaintTransformer gradientTransformer;", "modifier": "private", "type": "GradientPaintTransformer", "declarator": "gradientTransformer", "var_name": "gradientTransformer"}], "methods": [{"identifier": "XYAreaRenderer", "parameters": "()", "modifiers": "public", "return": "", "signature": " XYAreaRenderer()", "full_signature": "public  XYAreaRenderer()", "class_method_signature": "XYAreaRenderer.XYAreaRenderer()", "testcase": false, "constructor": true}, {"identifier": "XYAreaRenderer", "parameters": "(int type)", "modifiers": "public", "return": "", "signature": " XYAreaRenderer(int type)", "full_signature": "public  XYAreaRenderer(int type)", "class_method_signature": "XYAreaRenderer.XYAreaRenderer(int type)", "testcase": false, "constructor": true}, {"identifier": "XYAreaRenderer", "parameters": "(int type, XYToolTipGenerator toolTipGenerator,\n                          XYURLGenerator urlGenerator)", "modifiers": "public", "return": "", "signature": " XYAreaRenderer(int type, XYToolTipGenerator toolTipGenerator,\n                          XYURLGenerator urlGenerator)", "full_signature": "public  XYAreaRenderer(int type, XYToolTipGenerator toolTipGenerator,\n                          XYURLGenerator urlGenerator)", "class_method_signature": "XYAreaRenderer.XYAreaRenderer(int type, XYToolTipGenerator toolTipGenerator,\n                          XYURLGenerator urlGenerator)", "testcase": false, "constructor": true}, {"identifier": "getPlotShapes", "parameters": "()", "modifiers": "public", "return": "boolean", "signature": "boolean getPlotShapes()", "full_signature": "public boolean getPlotShapes()", "class_method_signature": "XYAreaRenderer.getPlotShapes()", "testcase": false, "constructor": false}, {"identifier": "getPlotLines", "parameters": "()", "modifiers": "public", "return": "boolean", "signature": "boolean getPlotLines()", "full_signature": "public boolean getPlotLines()", "class_method_signature": "XYAreaRenderer.getPlotLines()", "testcase": false, "constructor": false}, {"identifier": "getPlotArea", "parameters": "()", "modifiers": "public", "return": "boolean", "signature": "boolean getPlotArea()", "full_signature": "public boolean getPlotArea()", "class_method_signature": "XYAreaRenderer.getPlotArea()", "testcase": false, "constructor": false}, {"identifier": "isOutline", "parameters": "()", "modifiers": "public", "return": "boolean", "signature": "boolean isOutline()", "full_signature": "public boolean isOutline()", "class_method_signature": "XYAreaRenderer.isOutline()", "testcase": false, "constructor": false}, {"identifier": "setOutline", "parameters": "(boolean show)", "modifiers": "public", "return": "void", "signature": "void setOutline(boolean show)", "full_signature": "public void setOutline(boolean show)", "class_method_signature": "XYAreaRenderer.setOutline(boolean show)", "testcase": false, "constructor": false}, {"identifier": "getLegendArea", "parameters": "()", "modifiers": "public", "return": "Shape", "signature": "Shape getLegendArea()", "full_signature": "public Shape getLegendArea()", "class_method_signature": "XYAreaRenderer.getLegendArea()", "testcase": false, "constructor": false}, {"identifier": "setLegendArea", "parameters": "(Shape area)", "modifiers": "public", "return": "void", "signature": "void setLegendArea(Shape area)", "full_signature": "public void setLegendArea(Shape area)", "class_method_signature": "XYAreaRenderer.setLegendArea(Shape area)", "testcase": false, "constructor": false}, {"identifier": "getUseFillPaint", "parameters": "()", "modifiers": "public", "return": "boolean", "signature": "boolean getUseFillPaint()", "full_signature": "public boolean getUseFillPaint()", "class_method_signature": "XYAreaRenderer.getUseFillPaint()", "testcase": false, "constructor": false}, {"identifier": "setUseFillPaint", "parameters": "(boolean use)", "modifiers": "public", "return": "void", "signature": "void setUseFillPaint(boolean use)", "full_signature": "public void setUseFillPaint(boolean use)", "class_method_signature": "XYAreaRenderer.setUseFillPaint(boolean use)", "testcase": false, "constructor": false}, {"identifier": "getGradientTransformer", "parameters": "()", "modifiers": "public", "return": "GradientPaintTransformer", "signature": "GradientPaintTransformer getGradientTransformer()", "full_signature": "public GradientPaintTransformer getGradientTransformer()", "class_method_signature": "XYAreaRenderer.getGradientTransformer()", "testcase": false, "constructor": false}, {"identifier": "setGradientTransformer", "parameters": "(GradientPaintTransformer transformer)", "modifiers": "public", "return": "void", "signature": "void setGradientTransformer(GradientPaintTransformer transformer)", "full_signature": "public void setGradientTransformer(GradientPaintTransformer transformer)", "class_method_signature": "XYAreaRenderer.setGradientTransformer(GradientPaintTransformer transformer)", "testcase": false, "constructor": false}, {"identifier": "initialise", "parameters": "(Graphics2D g2, Rectangle2D dataArea,\n            XYPlot plot, XYDataset data, PlotRenderingInfo info)", "modifiers": "public", "return": "XYItemRendererState", "signature": "XYItemRendererState initialise(Graphics2D g2, Rectangle2D dataArea,\n            XYPlot plot, XYDataset data, PlotRenderingInfo info)", "full_signature": "public XYItemRendererState initialise(Graphics2D g2, Rectangle2D dataArea,\n            XYPlot plot, XYDataset data, PlotRenderingInfo info)", "class_method_signature": "XYAreaRenderer.initialise(Graphics2D g2, Rectangle2D dataArea,\n            XYPlot plot, XYDataset data, PlotRenderingInfo info)", "testcase": false, "constructor": false}, {"identifier": "getLegendItem", "parameters": "(int datasetIndex, int series)", "modifiers": "public", "return": "LegendItem", "signature": "LegendItem getLegendItem(int datasetIndex, int series)", "full_signature": "public LegendItem getLegendItem(int datasetIndex, int series)", "class_method_signature": "XYAreaRenderer.getLegendItem(int datasetIndex, int series)", "testcase": false, "constructor": false}, {"identifier": "drawItem", "parameters": "(Graphics2D g2, XYItemRendererState state,\n            Rectangle2D dataArea, XYPlot plot, ValueAxis domainAxis,\n            ValueAxis rangeAxis, XYDataset dataset,\n            int series, int item, boolean selected, int pass)", "modifiers": "public", "return": "void", "signature": "void drawItem(Graphics2D g2, XYItemRendererState state,\n            Rectangle2D dataArea, XYPlot plot, ValueAxis domainAxis,\n            ValueAxis rangeAxis, XYDataset dataset,\n            int series, int item, boolean selected, int pass)", "full_signature": "public void drawItem(Graphics2D g2, XYItemRendererState state,\n            Rectangle2D dataArea, XYPlot plot, ValueAxis domainAxis,\n            ValueAxis rangeAxis, XYDataset dataset,\n            int series, int item, boolean selected, int pass)", "class_method_signature": "XYAreaRenderer.drawItem(Graphics2D g2, XYItemRendererState state,\n            Rectangle2D dataArea, XYPlot plot, ValueAxis domainAxis,\n            ValueAxis rangeAxis, XYDataset dataset,\n            int series, int item, boolean selected, int pass)", "testcase": false, "constructor": false}, {"identifier": "clone", "parameters": "()", "modifiers": "public", "return": "Object", "signature": "Object clone()", "full_signature": "public Object clone()", "class_method_signature": "XYAreaRenderer.clone()", "testcase": false, "constructor": false}, {"identifier": "equals", "parameters": "(Object obj)", "modifiers": "public", "return": "boolean", "signature": "boolean equals(Object obj)", "full_signature": "public boolean equals(Object obj)", "class_method_signature": "XYAreaRenderer.equals(Object obj)", "testcase": false, "constructor": false}, {"identifier": "hashCode", "parameters": "()", "modifiers": "public", "return": "int", "signature": "int hashCode()", "full_signature": "public int hashCode()", "class_method_signature": "XYAreaRenderer.hashCode()", "testcase": false, "constructor": false}, {"identifier": "readObject", "parameters": "(ObjectInputStream stream)", "modifiers": "private", "return": "void", "signature": "void readObject(ObjectInputStream stream)", "full_signature": "private void readObject(ObjectInputStream stream)", "class_method_signature": "XYAreaRenderer.readObject(ObjectInputStream stream)", "testcase": false, "constructor": false}, {"identifier": "writeObject", "parameters": "(ObjectOutputStream stream)", "modifiers": "private", "return": "void", "signature": "void writeObject(ObjectOutputStream stream)", "full_signature": "private void writeObject(ObjectOutputStream stream)", "class_method_signature": "XYAreaRenderer.writeObject(ObjectOutputStream stream)", "testcase": false, "constructor": false}], "file": "source/org/jfree/chart/renderer/xy/XYAreaRenderer.java"}, "focal_method": {"identifier": "getLegendItem", "parameters": "(int datasetIndex, int series)", "modifiers": "public", "return": "LegendItem", "body": "public LegendItem getLegendItem(int datasetIndex, int series) {\n        LegendItem result = null;\n        XYPlot xyplot = getPlot();\n        if (xyplot != null) {\n            XYDataset dataset = xyplot.getDataset(datasetIndex);\n            if (dataset != null) {\n                XYSeriesLabelGenerator lg = getLegendItemLabelGenerator();\n                String label = lg.generateLabel(dataset, series);\n                String description = label;\n                String toolTipText = null;\n                if (getLegendItemToolTipGenerator() != null) {\n                    toolTipText = getLegendItemToolTipGenerator().generateLabel(\n                            dataset, series);\n                }\n                String urlText = null;\n                if (getLegendItemURLGenerator() != null) {\n                    urlText = getLegendItemURLGenerator().generateLabel(\n                            dataset, series);\n                }\n                Paint paint = lookupSeriesPaint(series);\n                result = new LegendItem(label, description, toolTipText,\n                        urlText, this.legendArea, paint);\n                result.setLabelFont(lookupLegendTextFont(series));\n                Paint labelPaint = lookupLegendTextPaint(series);\n                if (labelPaint != null) {\n                    result.setLabelPaint(labelPaint);\n                }\n                result.setDataset(dataset);\n                result.setDatasetIndex(datasetIndex);\n                result.setSeriesKey(dataset.getSeriesKey(series));\n                result.setSeriesIndex(series);\n            }\n        }\n        return result;\n    }", "signature": "LegendItem getLegendItem(int datasetIndex, int series)", "full_signature": "public LegendItem getLegendItem(int datasetIndex, int series)", "class_method_signature": "XYAreaRenderer.getLegendItem(int datasetIndex, int series)", "testcase": false, "constructor": false, "invocations": ["getPlot", "getDataset", "getLegendItemLabelGenerator", "generateLabel", "getLegendItemToolTipGenerator", "generateLabel", "getLegendItemToolTipGenerator", "getLegendItemURLGenerator", "generateLabel", "getLegendItemURLGenerator", "lookupSeriesPaint", "setLabelFont", "lookupLegendTextFont", "lookupLegendTextPaint", "setLabelPaint", "setDataset", "setDatasetIndex", "setSeriesKey", "getSeriesKey", "setSeriesIndex"]}, "repository": {"repo_id": "Chart_1_buggy"}}