{"test_class": {"identifier": "WaterfallBarRendererTests", "superclass": "extends TestCase", "interfaces": "", "fields": [], "file": "tests/org/jfree/chart/renderer/category/junit/WaterfallBarRendererTests.java"}, "test_case": {"identifier": "testEquals", "parameters": "()", "modifiers": "public", "return": "void", "body": "public void testEquals() {\n        WaterfallBarRenderer r1 = new WaterfallBarRenderer();\n        WaterfallBarRenderer r2 = new WaterfallBarRenderer();\n        assertEquals(r1, r2);\n\n        // firstBarPaint;\n        r1.setFirstBarPaint(Color.cyan);\n        assertFalse(r1.equals(r2));\n        r2.setFirstBarPaint(Color.cyan);\n        assertTrue(r1.equals(r2));\n\n        // lastBarPaint;\n        r1.setLastBarPaint(Color.cyan);\n        assertFalse(r1.equals(r2));\n        r2.setLastBarPaint(Color.cyan);\n        assertTrue(r1.equals(r2));\n\n        // positiveBarPaint;\n        r1.setPositiveBarPaint(Color.cyan);\n        assertFalse(r1.equals(r2));\n        r2.setPositiveBarPaint(Color.cyan);\n        assertTrue(r1.equals(r2));\n\n        //private Paint negativeBarPaint;\n        r1.setNegativeBarPaint(Color.cyan);\n        assertFalse(r1.equals(r2));\n        r2.setNegativeBarPaint(Color.cyan);\n        assertTrue(r1.equals(r2));\n\n    }", "signature": "void testEquals()", "full_signature": "public void testEquals()", "class_method_signature": "WaterfallBarRendererTests.testEquals()", "testcase": true, "constructor": false, "invocations": ["assertEquals", "setFirstBarPaint", "assertFalse", "equals", "setFirstBarPaint", "assertTrue", "equals", "setLastBarPaint", "assertFalse", "equals", "setLastBarPaint", "assertTrue", "equals", "setPositiveBarPaint", "assertFalse", "equals", "setPositiveBarPaint", "assertTrue", "equals", "setNegativeBarPaint", "assertFalse", "equals", "setNegativeBarPaint", "assertTrue", "equals"]}, "focal_class": {"identifier": "WaterfallBarRenderer", "superclass": "extends BarRenderer", "interfaces": "", "fields": [{"original_string": "private static final long serialVersionUID = -2482910643727230911L;", "modifier": "private static final", "type": "long", "declarator": "serialVersionUID = -2482910643727230911L", "var_name": "serialVersionUID"}, {"original_string": "private transient Paint firstBarPaint;", "modifier": "private transient", "type": "Paint", "declarator": "firstBarPaint", "var_name": "firstBarPaint"}, {"original_string": "private transient Paint lastBarPaint;", "modifier": "private transient", "type": "Paint", "declarator": "lastBarPaint", "var_name": "lastBarPaint"}, {"original_string": "private transient Paint positiveBarPaint;", "modifier": "private transient", "type": "Paint", "declarator": "positiveBarPaint", "var_name": "positiveBarPaint"}, {"original_string": "private transient Paint negativeBarPaint;", "modifier": "private transient", "type": "Paint", "declarator": "negativeBarPaint", "var_name": "negativeBarPaint"}], "methods": [{"identifier": "WaterfallBarRenderer", "parameters": "()", "modifiers": "public", "return": "", "signature": " WaterfallBarRenderer()", "full_signature": "public  WaterfallBarRenderer()", "class_method_signature": "WaterfallBarRenderer.WaterfallBarRenderer()", "testcase": false, "constructor": true}, {"identifier": "WaterfallBarRenderer", "parameters": "(Paint firstBarPaint,\n                                Paint positiveBarPaint,\n                                Paint negativeBarPaint,\n                                Paint lastBarPaint)", "modifiers": "public", "return": "", "signature": " WaterfallBarRenderer(Paint firstBarPaint,\n                                Paint positiveBarPaint,\n                                Paint negativeBarPaint,\n                                Paint lastBarPaint)", "full_signature": "public  WaterfallBarRenderer(Paint firstBarPaint,\n                                Paint positiveBarPaint,\n                                Paint negativeBarPaint,\n                                Paint lastBarPaint)", "class_method_signature": "WaterfallBarRenderer.WaterfallBarRenderer(Paint firstBarPaint,\n                                Paint positiveBarPaint,\n                                Paint negativeBarPaint,\n                                Paint lastBarPaint)", "testcase": false, "constructor": true}, {"identifier": "getFirstBarPaint", "parameters": "()", "modifiers": "public", "return": "Paint", "signature": "Paint getFirstBarPaint()", "full_signature": "public Paint getFirstBarPaint()", "class_method_signature": "WaterfallBarRenderer.getFirstBarPaint()", "testcase": false, "constructor": false}, {"identifier": "setFirstBarPaint", "parameters": "(Paint paint)", "modifiers": "public", "return": "void", "signature": "void setFirstBarPaint(Paint paint)", "full_signature": "public void setFirstBarPaint(Paint paint)", "class_method_signature": "WaterfallBarRenderer.setFirstBarPaint(Paint paint)", "testcase": false, "constructor": false}, {"identifier": "getLastBarPaint", "parameters": "()", "modifiers": "public", "return": "Paint", "signature": "Paint getLastBarPaint()", "full_signature": "public Paint getLastBarPaint()", "class_method_signature": "WaterfallBarRenderer.getLastBarPaint()", "testcase": false, "constructor": false}, {"identifier": "setLastBarPaint", "parameters": "(Paint paint)", "modifiers": "public", "return": "void", "signature": "void setLastBarPaint(Paint paint)", "full_signature": "public void setLastBarPaint(Paint paint)", "class_method_signature": "WaterfallBarRenderer.setLastBarPaint(Paint paint)", "testcase": false, "constructor": false}, {"identifier": "getPositiveBarPaint", "parameters": "()", "modifiers": "public", "return": "Paint", "signature": "Paint getPositiveBarPaint()", "full_signature": "public Paint getPositiveBarPaint()", "class_method_signature": "WaterfallBarRenderer.getPositiveBarPaint()", "testcase": false, "constructor": false}, {"identifier": "setPositiveBarPaint", "parameters": "(Paint paint)", "modifiers": "public", "return": "void", "signature": "void setPositiveBarPaint(Paint paint)", "full_signature": "public void setPositiveBarPaint(Paint paint)", "class_method_signature": "WaterfallBarRenderer.setPositiveBarPaint(Paint paint)", "testcase": false, "constructor": false}, {"identifier": "getNegativeBarPaint", "parameters": "()", "modifiers": "public", "return": "Paint", "signature": "Paint getNegativeBarPaint()", "full_signature": "public Paint getNegativeBarPaint()", "class_method_signature": "WaterfallBarRenderer.getNegativeBarPaint()", "testcase": false, "constructor": false}, {"identifier": "setNegativeBarPaint", "parameters": "(Paint paint)", "modifiers": "public", "return": "void", "signature": "void setNegativeBarPaint(Paint paint)", "full_signature": "public void setNegativeBarPaint(Paint paint)", "class_method_signature": "WaterfallBarRenderer.setNegativeBarPaint(Paint paint)", "testcase": false, "constructor": false}, {"identifier": "findRangeBounds", "parameters": "(CategoryDataset dataset)", "modifiers": "public", "return": "Range", "signature": "Range findRangeBounds(CategoryDataset dataset)", "full_signature": "public Range findRangeBounds(CategoryDataset dataset)", "class_method_signature": "WaterfallBarRenderer.findRangeBounds(CategoryDataset dataset)", "testcase": false, "constructor": false}, {"identifier": "drawItem", "parameters": "(Graphics2D g2, CategoryItemRendererState state,\n            Rectangle2D dataArea, CategoryPlot plot, CategoryAxis domainAxis,\n            ValueAxis rangeAxis, CategoryDataset dataset, int row, int column,\n            boolean selected, int pass)", "modifiers": "public", "return": "void", "signature": "void drawItem(Graphics2D g2, CategoryItemRendererState state,\n            Rectangle2D dataArea, CategoryPlot plot, CategoryAxis domainAxis,\n            ValueAxis rangeAxis, CategoryDataset dataset, int row, int column,\n            boolean selected, int pass)", "full_signature": "public void drawItem(Graphics2D g2, CategoryItemRendererState state,\n            Rectangle2D dataArea, CategoryPlot plot, CategoryAxis domainAxis,\n            ValueAxis rangeAxis, CategoryDataset dataset, int row, int column,\n            boolean selected, int pass)", "class_method_signature": "WaterfallBarRenderer.drawItem(Graphics2D g2, CategoryItemRendererState state,\n            Rectangle2D dataArea, CategoryPlot plot, CategoryAxis domainAxis,\n            ValueAxis rangeAxis, CategoryDataset dataset, int row, int column,\n            boolean selected, int pass)", "testcase": false, "constructor": false}, {"identifier": "equals", "parameters": "(Object obj)", "modifiers": "public", "return": "boolean", "signature": "boolean equals(Object obj)", "full_signature": "public boolean equals(Object obj)", "class_method_signature": "WaterfallBarRenderer.equals(Object obj)", "testcase": false, "constructor": false}, {"identifier": "writeObject", "parameters": "(ObjectOutputStream stream)", "modifiers": "private", "return": "void", "signature": "void writeObject(ObjectOutputStream stream)", "full_signature": "private void writeObject(ObjectOutputStream stream)", "class_method_signature": "WaterfallBarRenderer.writeObject(ObjectOutputStream stream)", "testcase": false, "constructor": false}, {"identifier": "readObject", "parameters": "(ObjectInputStream stream)", "modifiers": "private", "return": "void", "signature": "void readObject(ObjectInputStream stream)", "full_signature": "private void readObject(ObjectInputStream stream)", "class_method_signature": "WaterfallBarRenderer.readObject(ObjectInputStream stream)", "testcase": false, "constructor": false}], "file": "source/org/jfree/chart/renderer/category/WaterfallBarRenderer.java"}, "focal_method": {"identifier": "equals", "parameters": "(Object obj)", "modifiers": "public", "return": "boolean", "body": "public boolean equals(Object obj) {\n\n        if (obj == this) {\n            return true;\n        }\n        if (!super.equals(obj)) {\n            return false;\n        }\n        if (!(obj instanceof WaterfallBarRenderer)) {\n            return false;\n        }\n        WaterfallBarRenderer that = (WaterfallBarRenderer) obj;\n        if (!PaintUtilities.equal(this.firstBarPaint, that.firstBarPaint)) {\n            return false;\n        }\n        if (!PaintUtilities.equal(this.lastBarPaint, that.lastBarPaint)) {\n            return false;\n        }\n        if (!PaintUtilities.equal(this.positiveBarPaint,\n                that.positiveBarPaint)) {\n            return false;\n        }\n        if (!PaintUtilities.equal(this.negativeBarPaint,\n                that.negativeBarPaint)) {\n            return false;\n        }\n        return true;\n\n    }", "signature": "boolean equals(Object obj)", "full_signature": "public boolean equals(Object obj)", "class_method_signature": "WaterfallBarRenderer.equals(Object obj)", "testcase": false, "constructor": false, "invocations": ["equals", "equal", "equal", "equal", "equal"]}, "repository": {"repo_id": "Chart_1_buggy"}}