{"test_class": {"identifier": "StandardPieURLGeneratorTests", "superclass": "extends TestCase", "interfaces": "", "fields": [], "file": "tests/org/jfree/chart/urls/junit/StandardPieURLGeneratorTests.java"}, "test_case": {"identifier": "testEquals", "parameters": "()", "modifiers": "public", "return": "void", "body": "public void testEquals() {\n        StandardPieURLGenerator g1 = new StandardPieURLGenerator();\n        StandardPieURLGenerator g2 = new StandardPieURLGenerator();\n        assertTrue(g1.equals(g2));\n\n        g1 = new StandardPieURLGenerator(\"prefix\", \"category\", \"index\");\n        assertFalse(g1.equals(g2));\n        g2 = new StandardPieURLGenerator(\"prefix\", \"category\", \"index\");\n        assertTrue(g1.equals(g2));\n\n        g1 = new StandardPieURLGenerator(\"prefix2\", \"category\", \"index\");\n        assertFalse(g1.equals(g2));\n        g2 = new StandardPieURLGenerator(\"prefix2\", \"category\", \"index\");\n        assertTrue(g1.equals(g2));\n\n        g1 = new StandardPieURLGenerator(\"prefix2\", \"category2\", \"index\");\n        assertFalse(g1.equals(g2));\n        g2 = new StandardPieURLGenerator(\"prefix2\", \"category2\", \"index\");\n        assertTrue(g1.equals(g2));\n\n        g1 = new StandardPieURLGenerator(\"prefix2\", \"category2\", \"index2\");\n        assertFalse(g1.equals(g2));\n        g2 = new StandardPieURLGenerator(\"prefix2\", \"category2\", \"index2\");\n        assertTrue(g1.equals(g2));\n\n        g1 = new StandardPieURLGenerator(\"prefix2\", \"category2\", null);\n        assertFalse(g1.equals(g2));\n        g2 = new StandardPieURLGenerator(\"prefix2\", \"category2\", null);\n        assertTrue(g1.equals(g2));\n    }", "signature": "void testEquals()", "full_signature": "public void testEquals()", "class_method_signature": "StandardPieURLGeneratorTests.testEquals()", "testcase": true, "constructor": false, "invocations": ["assertTrue", "equals", "assertFalse", "equals", "assertTrue", "equals", "assertFalse", "equals", "assertTrue", "equals", "assertFalse", "equals", "assertTrue", "equals", "assertFalse", "equals", "assertTrue", "equals", "assertFalse", "equals", "assertTrue", "equals"]}, "focal_class": {"identifier": "StandardPieURLGenerator", "superclass": "", "interfaces": "implements PieURLGenerator, Serializable", "fields": [{"original_string": "private static final long serialVersionUID = 1626966402065883419L;", "modifier": "private static final", "type": "long", "declarator": "serialVersionUID = 1626966402065883419L", "var_name": "serialVersionUID"}, {"original_string": "private String prefix = \"index.html\";", "modifier": "private", "type": "String", "declarator": "prefix = \"index.html\"", "var_name": "prefix"}, {"original_string": "private String categoryParameterName = \"category\";", "modifier": "private", "type": "String", "declarator": "categoryParameterName = \"category\"", "var_name": "categoryParameterName"}, {"original_string": "private String indexParameterName = \"pieIndex\";", "modifier": "private", "type": "String", "declarator": "indexParameterName = \"pieIndex\"", "var_name": "indexParameterName"}], "methods": [{"identifier": "StandardPieURLGenerator", "parameters": "()", "modifiers": "public", "return": "", "signature": " StandardPieURLGenerator()", "full_signature": "public  StandardPieURLGenerator()", "class_method_signature": "StandardPieURLGenerator.StandardPieURLGenerator()", "testcase": false, "constructor": true}, {"identifier": "StandardPieURLGenerator", "parameters": "(String prefix)", "modifiers": "public", "return": "", "signature": " StandardPieURLGenerator(String prefix)", "full_signature": "public  StandardPieURLGenerator(String prefix)", "class_method_signature": "StandardPieURLGenerator.StandardPieURLGenerator(String prefix)", "testcase": false, "constructor": true}, {"identifier": "StandardPieURLGenerator", "parameters": "(String prefix,\n                                   String categoryParameterName)", "modifiers": "public", "return": "", "signature": " StandardPieURLGenerator(String prefix,\n                                   String categoryParameterName)", "full_signature": "public  StandardPieURLGenerator(String prefix,\n                                   String categoryParameterName)", "class_method_signature": "StandardPieURLGenerator.StandardPieURLGenerator(String prefix,\n                                   String categoryParameterName)", "testcase": false, "constructor": true}, {"identifier": "StandardPieURLGenerator", "parameters": "(String prefix,\n                                   String categoryParameterName,\n                                   String indexParameterName)", "modifiers": "public", "return": "", "signature": " StandardPieURLGenerator(String prefix,\n                                   String categoryParameterName,\n                                   String indexParameterName)", "full_signature": "public  StandardPieURLGenerator(String prefix,\n                                   String categoryParameterName,\n                                   String indexParameterName)", "class_method_signature": "StandardPieURLGenerator.StandardPieURLGenerator(String prefix,\n                                   String categoryParameterName,\n                                   String indexParameterName)", "testcase": false, "constructor": true}, {"identifier": "generateURL", "parameters": "(PieDataset dataset, Comparable key,\n            int pieIndex)", "modifiers": "public", "return": "String", "signature": "String generateURL(PieDataset dataset, Comparable key,\n            int pieIndex)", "full_signature": "public String generateURL(PieDataset dataset, Comparable key,\n            int pieIndex)", "class_method_signature": "StandardPieURLGenerator.generateURL(PieDataset dataset, Comparable key,\n            int pieIndex)", "testcase": false, "constructor": false}, {"identifier": "equals", "parameters": "(Object obj)", "modifiers": "public", "return": "boolean", "signature": "boolean equals(Object obj)", "full_signature": "public boolean equals(Object obj)", "class_method_signature": "StandardPieURLGenerator.equals(Object obj)", "testcase": false, "constructor": false}], "file": "source/org/jfree/chart/urls/StandardPieURLGenerator.java"}, "focal_method": {"identifier": "equals", "parameters": "(Object obj)", "modifiers": "public", "return": "boolean", "body": "public boolean equals(Object obj) {\n        if (obj == this) {\n            return true;\n        }\n        if (!(obj instanceof StandardPieURLGenerator)) {\n            return false;\n        }\n        StandardPieURLGenerator that = (StandardPieURLGenerator) obj;\n        if (!this.prefix.equals(that.prefix)) {\n            return false;\n        }\n        if (!this.categoryParameterName.equals(that.categoryParameterName)) {\n            return false;\n        }\n        if (!ObjectUtilities.equal(this.indexParameterName,\n                that.indexParameterName)) {\n            return false;\n        }\n        return true;\n    }", "signature": "boolean equals(Object obj)", "full_signature": "public boolean equals(Object obj)", "class_method_signature": "StandardPieURLGenerator.equals(Object obj)", "testcase": false, "constructor": false, "invocations": ["equals", "equals", "equal"]}, "repository": {"repo_id": "Chart_1_buggy"}}